I: Why?,,,0,0,0,0,0,,0,,0,0,0,0,0,0,0,0,0,0,
Because what's going to happen is if I change something - unlike the previous task there were no internal I guess dependencies. There was nothing else in the same file calling it it was just the tests. Luckily one thing that will be helpful is that the compiler will complain when we remove this because it'll be like we're using this. But what will happen is that one approach I can do is to change that then find the broken stuff and fix it later the other thing I can do is what I'm doing right now which is to look ahead of the time to see what will break. Which personally I prefer.,,,0,0,0,0,0,,0,,0,0,0,0,0,0,0,0,0,0,
I: How come?,,,0,0,0,0,0,,0,,0,0,0,0,0,0,0,0,0,0,
Because I like to at least know what I'm getting into before [starting]. It depends if I was really rushed I'd probably just start changing things but I feel - right now especially because I know that I have over an hour left - I am slowing down a little bit.,,,0,0,0,0,0,,0,,0,0,0,0,0,0,0,0,0,0,
I: What do you mean by getting yourself into what are you considering then?,,,0,0,0,0,0,,0,,0,0,0,0,0,0,0,0,0,0,
If I change this - I guess how daunting it is - is it going to be an easy change or a hard change; like I want to estimate ahead of time an estimate. It's like if my friends asked me to sign up for whitewater rafting I'd want to look into what that entails ahead of time instead of being like yeah let's go and then go oh no.,,,0,0,0,0,0,,0,,0,0,0,0,0,0,0,0,0,0,
I: So what kind of things are you looking for here?,,,0,0,0,0,0,,0,,0,0,0,0,0,0,0,0,0,0,
It's more involved that the last one because there's more in here. It's more potential for it to not behave as intented. That's really it. That was getfield readfield rightfield. It looks like though maybe I'm looking in the wrong place but it looks like we're just trying to find all the places that force-boolean is used. I know for a fact that the only place it's going to be called final boolean is in the method signature so I'll just search where it is.,,,0,0,0,0,0,,0,,0,0,0,0,0,0,0,0,0,0,
I: There's matches on the side there.,,,0,0,0,0,0,,0,,0,0,0,0,0,0,0,0,0,0,
And we have 7 matches so it looks like it's going to be 7 places.,,,0,0,0,0,0,,0,,0,0,0,0,0,0,0,0,0,0,
There's two ways I could approach this: one way is to find the root-methods that are referenced by other methods start changing those first and then fix the other methods that are broken accordingly. The other way is to immediately go to the other methods just remove all the one that use the boolean and then go in there and finally fix up the last one. I'm not sure what approach is better honestly; one involves a lot more red lines than the other.,,,0,0,0,0,0,,0,,0,0,0,0,0,0,0,0,0,0,
I: Is that a good or a bad thing?,,,0,0,0,0,0,,0,,0,0,0,0,0,0,0,0,0,0,
I am not sure. I talked earlier about how I do rely on the compiler. I would say that the easiest one is probably to start removing from the signatures everywhere especially since there are some pretty simple ones here. So what will happen is that because the default wrappers are in there it shouldn't break them it should still just work. So I'm going to start by - and I know that there will be some tests that use this so I'll fix that ahead of time. Ok so what I'll do. [49:11],,,0,0,0,0,0,,0,,0,0,0,0,0,0,0,0,0,0,
I am going to start by removing the field from all the method signatures and remove all the corresponding references to it and then fixing the more core functionality but as soon as I remove this I'll also fix the tests ahead of time. And to me this is a decent approach because there is already the default and the default parameter is false. I would say it would be more compllicated if the default parameter was true. One thing to also note ahead of time is that in here in the tests what's going to happen is.. Something is on my mind something will happen.. I'm not sure it's my gut feeling that something is missing oh right I haven't run the tests yet. I should do that first. Especially based on my current position the tests don't always pass.. But this is an open-source code base so I guess it makes sense to be confident ... Ok it's passing right now.,,,0,0,0,0,0,,0,,0,0,0,0,0,0,0,0,0,0,
So let's get back to what the appoach. I'm just going to start by deleting the ...changing how we are defining the methods. I'm going to start with ... I feel like I am taking to long to deliberate where to start. This is not just for the experiment I can have a bit of inertia and once I commit to something.. but I haven't actually committed to something yet just hovering around. It's like this whitewater rafting course and I'm just like should I pay yet and I'm kind of like saving it for the last minute but this is actually committing. So let's see this is getField.. I've decided that I'm going to go with the approach that uses the red lines and start by changing this one because it is going to provide me with a visual reminder of where to jump. So getField - i'm just going to find usages again. Oh right ... I can change the signature using this tool can't I?,,"
 Invoke (Change Signature)",0,0,0,0,0,,1,,0,0,0,0,0,0,0,0,0,0,Change Signature
I'll be honest I've never used this. I guess I've used something similar in Eclipse. Remember I said I've self-confessed ludite tendencies like because I don't know the tool I might actually just - oh there's a preview. What happens if I just remove this?,,,0,0,0,0,0,,0,,0,0,0,0,0,0,0,0,0,0,
I: You can remove it through the minus sign here.,,,0,0,0,0,0,,0,,0,0,0,0,0,0,0,0,0,0,
So what happens if I remove this? The problem is that it's already defined - ah of course we already have oh by the way I'll admit straight up I'm biased to look at this tool because I'm self-aware of being in a study of refactoring tools.,"Invocation
Predictable
 (“what happens if I remove this? The problem is that it's already defined“)",,1,0,0,0,0,"<1,0,0,0,0>",0,135-140,1,0,0,0,0,0,0,0,0,0,
I: So you wouldn't normally have looked at it?,,,0,0,0,0,0,,0,,0,0,0,0,0,0,0,0,0,0,
I might have if a co-worker had shown it to me. I think the thing with IDEs the reason I do some of this stuff in Eclipse is because I was shown some of these things when I was an intern. The fact that I've never had anyone sit me down and and say - I guess I've never devoted time at work that I should sit down and learn my IDE. It's mostly just let's get this done. I guess I've just used an approach that works.,,,0,0,0,0,0,,0,,0,0,0,0,0,0,0,0,0,0,
Anyway. I feel like what's going to happen is what I'd do is just delete this method now then I know that some times with certain IDEs I am not sure if I remove a method it might complain somewhere else and it might not let me refactor if there already is compile issues.,"Invocation
Not Effective 
 (“it might not let me refactor”)",,0,1,0,0,0,"<0,1,0,0,0>",0,,0,0,0,0,0,0,1,0,0,0,
I: So what was you original plan you want to remove..,,,0,0,0,0,0,,0,,0,0,0,0,0,0,0,0,0,0,
What I'll do is I'll just remove this instead of running refactor I'll just remove it and just look myself. I guess I just trust what I can see.,"Invocation
Not Trust",,0,0,0,1,0,"<0,0,0,1,0>",0,,0,0,0,0,0,0,0,0,1,0,
I: Right. But you were considering for a moment to remove the overloaded the default method and then using the refactoring tool right?,,,0,0,0,0,0,,0,,0,0,0,0,0,0,0,0,0,0,
Yes I did consider that but then I thought it might be problematic because sometimes I have had experiences like you do this and then you try to do something else and then it's like you can't do this because it's currently broken. [55:36],,,0,0,0,0,0,,0,,0,0,0,0,0,0,0,0,0,0,
I can just undo that I guess.,,Invoke (Change Signature),0,0,0,0,0,,1,,0,0,0,0,0,0,0,0,0,0,Change Signature
parameter forceaccess is used in methodbody. Oh it's saying it's used somewhere - wait - what's that trying to say? Oh it's saying it's used - but that's fine; I'm going to do this and it's going to complain and I'm ok with that. Because I realise that there's no way to do this without something complaining. I feel like it's not going to be able to automatically remove it; besides there are some logic changes too.,,,0,0,0,0,0,,0,,0,0,0,0,0,0,0,0,0,0,
Continue.,,,0,0,0,0,0,,0,,0,0,0,0,0,0,0,0,0,0,
Alright!,"Invocation
Effective",,0,1,0,0,0,"<0,1,0,0,0>",0,146-152,0,1,0,0,0,0,0,0,0,0,
As I mentioned there's some red stuff here. That's fine. If forceaccess set accessible true else continue. It looks like we don't actually need this which means the else is always going to be true. so the question is what does the continue do? The continue will just go back to the beginning of the forloop. I was just looking to see if I actually needed to even have this if-statement up here but it sounds fine. I think that this should be ok because what's happening is if this boolean is false we want to just continue anyway otherwise we want to just return the field. Sure that should work. Ok so now I'm surprised - I'm kinda shocked that there's not more red in here because did I automatically remove it already?,"Invocation
Not Predictable 
 (“surprised” ..”did I automatically remove it already?”)",,1,0,0,0,0,"<1,0,0,0,0>",0,,0,0,0,0,0,1,0,0,0,0,
I: What do you think the tool did?,,,0,0,0,0,0,,0,,0,0,0,0,0,0,0,0,0,0,
Oh it probably already renamed everything that was using this. Ugh.,"Invocation
Not Satisfaction",,0,0,1,0,0,"<0,0,1,0,0>",0,,0,0,0,0,0,0,0,1,0,0,
I've just realized that I think one of the reasons I'm hesitant to use tools is because I don't know the full impact. If I were to look at a source control diff right now I would assume that we have some usages. There's going to be some very redundant test cases right now because they've probably been automatically renamed to use the default parameter right now. So if I were to look for getField in here ...,"Invocation
Not Predictable
 (“I don't know the full impact”)",,1,0,0,0,0,"<1,0,0,0,0>",0,,0,0,0,0,0,1,0,0,0,0,
what'll happen is that those test cases are probably going to break.,,,0,0,0,0,0,,0,,0,0,0,0,0,0,0,0,0,0,
If I hadn't used a refactoring tool and I would have just seen the red lines and known that this is exactly what I need to remove. What I'll do now is that I guess there's like a git diff thing I can use in here.,"Invocation
Not Efficient
 (“If I hadn't used a refactoring tool and I would have just seen the red lines and known that this is exactly what I need to remove.”)",,0,0,0,0,1,"<0,0,0,0,1>",0,,0,0,0,0,0,0,0,0,0,1,
I: You can go to - are you used to using git in the terminal?,,,0,0,0,0,0,,0,,0,0,0,0,0,0,0,0,0,0,
I usually use git in some visualizer.,,,0,0,0,0,0,,0,,0,0,0,0,0,0,0,0,0,0,
I: There is a view for it here but I'm not sure where. Here?,,,0,0,0,0,0,,0,,0,0,0,0,0,0,0,0,0,0,
I want to see git diff effectively.,,,0,0,0,0,0,,0,,0,0,0,0,0,0,0,0,0,0,
Compare with same repository version is probably - or show current revision.,,,0,0,0,0,0,,0,,0,0,0,0,0,0,0,0,0,0,
I: So what are you using this to figure out?,,,0,0,0,0,0,,0,,0,0,0,0,0,0,0,0,0,0,
I just want to figure out what was changed.,,,0,0,0,0,0,,0,,0,0,0,0,0,0,0,0,0,0,
I: So what the tool actually did?,,,0,0,0,0,0,,0,,0,0,0,0,0,0,0,0,0,0,
Yeah. Because look at all these things that had true in them which are now removed. I have a strong hunch that this test is now going to fail horribly because it assumed true but it's not going to test for that properly. I'm actually fairly confident that I should be removing this because - oh because literally the name is testgetFieldforceAccess. Everything else in yellow I'm just realising - I just think - why is it yellow?,,,0,0,0,0,0,,0,,0,0,0,0,0,0,0,0,0,0,
I: it's warnings,,,0,0,0,0,0,,0,,0,0,0,0,0,0,0,0,0,0,
testgetFieldforceAccess I'll just remove it,,,0,0,0,0,0,,0,,0,0,0,0,0,0,0,0,0,0,
I: So in this case you used git instead of the compile errors?,,,0,0,0,0,0,,0,,0,0,0,0,0,0,0,0,0,0,
Yeah so I guess my previous goto for this kind of thing would be to know that this is what I need to remove because the compiler is complaining but because this kind of tool automatically did a lot more for me it kind of disrupted my flow. This was because it was the first time I was doing this. But this time you know what .. I'm going to be frank and say the next thing I'll do is to go back to my old approach. Because this I guess because of the nature of the task - I guess it's all about control and I feel I am out of control when things happen automagically.,"Invocation
Effective
 (“this kind of tool automatically did a lot more for me”)
 Not Efficient 
 (“disrupted my flow”)
 Not Satisfaction
 (“I feel I am out of control”)",,0,1,1,0,1,"<0,1,1,0,1>",0,165-165,0,1,0,0,0,0,0,1,0,1,
It's like for long time i resisted using ducktype languages because I didn't like that you didn't have to explicitly say what things were.,,,0,0,0,0,0,,0,,0,0,0,0,0,0,0,0,0,0,
I: Was it different for you that it was in tests? 'Cause I don't think you checked this for the main file?,,,0,0,0,0,0,,0,,0,0,0,0,0,0,0,0,0,0,
I did not check it in the main file. I should check it in the main file. But I know that in the main file if I removed it it should be ok because when I looked at it earlier for getField - because I pre-looked - I don't think I found anywhere in the code where it was hardcoded. It's always like I'll just take this parameter and pass it on. Because right now the big thing is if you have somewhere that automatically populates it with true instead of passing the parameter that's where it would be less useful. Actually thinking about that now I really think I do want to stick to my old approach. Because now instead I'm just getting this here which just says that this is redundant it's not used. [1:03:33],,,0,0,0,0,0,,0,,0,0,0,0,0,0,0,0,0,0,
Ok so why is this failing. Probably because we have.. yeah it's because it's overloaded. [1:04:03],,,0,0,0,0,0,,0,,0,0,0,0,0,0,0,0,0,0,
We now have two methods with the same method signature of course it is going to complain.,,,0,0,0,0,0,,0,,0,0,0,0,0,0,0,0,0,0,
Oh it looks like intelliJ shows documentation warnings too. I'm just going to change that as well; I know it says you don't need to but I will.,,,0,0,0,0,0,,0,,0,0,0,0,0,0,0,0,0,0,
Ok let's go back. I changed one of the things already. Final boolean. Now I'm looking for boolean forceaccess. getDeclaredField. One thing I'm going to do - I'm going to change this; by changing this it tells me where the error is in here; I know that this - if forceAccess is true else return null so I know we don't need this any more this is never going to be true so this should only ah should only ever return null. Is that the case? We're only ever calling this with forceAccess ever set to false so it is the same as if the if check did not exist and only the else ever exist. And we're going to get that same complain; get declared field.,,,0,0,0,0,0,,0,,0,0,0,0,0,0,0,0,0,0,
By the way I just realised I have not rerun the tests unlike the first time I talked about validating my apporoach and I think it's because I got a little cocky. But it looks like we have had something change here so I'm just going to look at that.,,,0,0,0,0,0,,0,,0,0,0,0,0,0,0,0,0,0,
I: How are you navigating through the code now?,,,0,0,0,0,0,,0,,0,0,0,0,0,0,0,0,0,0,
I am just looking at the red lines. [1:06:03],,,0,0,0,0,0,,0,,0,0,0,0,0,0,0,0,0,0,
...That's all I don't want to change this. Down here. Right because of this...,,,0,0,0,0,0,,0,,0,0,0,0,0,0,0,0,0,0,
Ok so I've done a bunch of changes here I'm just going to rerun the tests. Technically I was supposed to run that after the first time to see if my appraoch worked.,,,0,0,0,0,0,,0,,0,0,0,0,0,0,0,0,0,0,
I: what do you mean by after the first time? After one change?,,,0,0,0,0,0,,0,,0,0,0,0,0,0,0,0,0,0,
Yeah. Here we go testGetDeclaredFieldForceAccess. This is the one with all the trues. For some reason it's giving me compilation errors. True true null true true. Yep these are all failed looks like they don't want to test these any more because we have a bunch of tests that cover it. And over here testWriteNameFieldForceAccess forceAccess true true true true. Yeah looks like we can just nuke this as well.,,,0,0,0,0,0,,0,,0,0,0,0,0,0,0,0,0,0,
It was more like I would have run it to make sure my approach worked first.,,,0,0,0,0,0,,0,,0,0,0,0,0,0,0,0,0,0,
I: What did you consider one thing here because you made a lot of different changes?,,,0,0,0,0,0,,0,,0,0,0,0,0,0,0,0,0,0,
In this particular case yes because I had to keep going and keep going and kind of ended up like sprawling about. I guess it was more like.. so the first time I did it it was this assumption that because they were separate if I took an approach to the first half and reapplied to the second half I wanted to make sure that my approach worked and I think I was trying to replicate this here. But I wonder if I instinctively knew that there was going to be an issue. Because .. this test here is failing right now so I probably missed someting. but this is good feedback. ReadField. I think this is the one I haven't actually changed yet because it's counting as compilation error. It looks like it's going to.. what happens here. ReadField.. if... so what happens if it's false? So really it just returns field.getTarget. So this is just a wrapper for field.getTrget. And it's a validation. We don't care if the field is accessible. Wait do we care? This is always going to be false. So this if-condition will never validate to true. ....,,,0,0,0,0,0,,0,,0,0,0,0,0,0,0,0,0,0,
Alright. Why is there still red in here. Two errors found - ah here they are. well we no longer actually need this forceaccess. We don't need it in the documentation any more. And we just need to remove the overloaded method because now we have two methods with the same signature which is no good in Java and the last thing here is - oh this one by default was always called with false. Oh that's weird I wonder why they called it explicitly with declared false. Oh by above I think they mean the.. I wonder why they didn't use the default parameter there.,,,0,0,0,0,0,,0,,0,0,0,0,0,0,0,0,0,0,
Right. So this entire test case just fails. But that's fine because everything here is expected to be true. Ok. Looks like everything is cleaned up. And one more for writeField. So what I'm going to do is I'm just going to clean up this up and then run the tests. I feel like because how entrenched it is - let's go back to here. So again it's the same because this is always going to be false. [1:13:13],,,0,0,0,0,0,,0,,0,0,0,0,0,0,0,0,0,0,
[1:13:29] This is a method that's conflicting with this one again the exact same thing happened it was just running the wrapped version. I just realised something - I have been deleting things - but I just realised - I don't know what happened to my mindset I guess I just got hasty - but I just realised there was actually some preable here with some - these weren't just simply calling wrapped classes there were actually some logic in here that I might actually not have preserved. I feel like I need to go back here because - yeah there is some validation in here. It's not as simple as calling writefield with false we actually have a lot of validation here.,,,0,0,0,0,0,,0,,0,0,0,0,0,0,0,0,0,0,
I: What made you realise that?,,,0,0,0,0,0,,0,,0,0,0,0,0,0,0,0,0,0,
I don't know why but I did just realise it.,,,0,0,0,0,0,,0,,0,0,0,0,0,0,0,0,0,0,
I: So what are you doing now?,,,0,0,0,0,0,,0,,0,0,0,0,0,0,0,0,0,0,
[1:14:15] I’m just going to undo a few things. But I'll also backtrack to the diff and just make sure that I actually remove - I'm going to read this class now. writeFiel field name while this has a field - OH now I realise what I'm doing here. I was deleting the wrong thing. This is what I was meant to delete. I just got confused because I saw some red but in actual fact that was just a case where it called false by default. I'm just going to change this real quick and then look at the diff now because I want things to get to a more consistent state. I think this was confusing in here. I had made an assumption that any time we were calling the false case the method invocation would not have false explicitly set but there was a particular case where it did and I think that threw me off thinking something had gone wrong but I think that if I check the diff it's actually going to be that everything I removed was correct.,,,0,0,0,0,0,,0,,0,0,0,0,0,0,0,0,0,0,
I: So you thought you made a mistake but you hadn't.,,,0,0,0,0,0,,0,,0,0,0,0,0,0,0,0,0,0,
Yes I mistakenly thought I made a mistake. But I'm going to double check now. I don't know why they didn't just type return field here but ok. Maybe because it's OS code? Here that's what I changed. Here - yeah they just return getDeclaredField. Yay consistency please be more consistent. Same thing here. Same thing here. Like this was an example that - yeah it looks like I'm actually correct I didn't make a mistake. I got confused somewhere and I panicked a little but I didn't actually do anything weird.,,,0,0,0,0,0,,0,,0,0,0,0,0,0,0,0,0,0,
I: So you misinterpreted ..,,,0,0,0,0,0,,0,,0,0,0,0,0,0,0,0,0,0,
I misinterepreted a change because I kinda went into autopilot and I started changing something else and I was like wait that's not what I'm actually supposed to be doing.,,,0,0,0,0,0,,0,,0,0,0,0,0,0,0,0,0,0,
Oh it looks like - this forceaccess flag is actually gone. And if I look at the methods none of them require booleans as parameters which was an assumption I made and I very quickly just verify and back to here - we have a bunch of stuff that is broken.,,,0,0,0,0,0,,0,,0,0,0,0,0,0,0,0,0,0,
I: Back to the tests?,,,0,0,0,0,0,,0,,0,0,0,0,0,0,0,0,0,0,
Yeah. I know that I need to remove this because it is all about testing that the broken is true. Because this is a well-written unit test - there is a lot of not-well-written unit tests that aren't actually unit tests - this test actually is very helpful because I know that I can safely remove it without losing functionality. That said I am going to do a diff but I'll run a test first.,,,0,0,0,0,0,,0,,0,0,0,0,0,0,0,0,0,0,
Oh we have some - oh they're static final. They could be used elsewhere. I don't think that is part of the scope of this but I don't think this was broken before I used this.,,,0,0,0,0,0,,0,,0,0,0,0,0,0,0,0,0,0,
I: What do you mean by broken? The warning?,,,0,0,0,0,0,,0,,0,0,0,0,0,0,0,0,0,0,
Yes I'm pretty sure it wasn't ... You know it is part of refactoring you do want to take out stuff that isn't useful. I see this and I'm like why is this being used. But maybe it's being used somewhere and I'm just not aware of it. Where is it used actually? Only within the test. But technically anything within the same package could actually use it. I'm just going to double check when I look through the diff if any of them uses IO or D0. I think this one moreso than the other one made me look at the diff 'cause I haven't looked at it before but I think it's just because it is slightly more complicated. And because I tried doing something I didn't and I ended up being ..,,,0,0,0,0,0,,0,,0,0,0,0,0,0,0,0,0,0,
Oh interesting it looks like the warning wasn't up here before so I'm going to assume one of these testclasses actually used it. What was the name of it? I0. Yeah. Well I'm actually going to remove these because they are reduntant they're not being used. In a production scenario I would run all the tests and they would break. But I'm also fairly certain that IntelliJ would have told me if someone else was using it. So let's go back up here. I don't think I've actually removed anything that's going to break. I've had to change documentation but it's because it was giving me compilation errors.,,,0,0,0,0,0,,0,,0,0,0,0,0,0,0,0,0,0,
I: That's ok.,,,0,0,0,0,0,,0,,0,0,0,0,0,0,0,0,0,0,
I'm done.,,,0,0,0,0,0,,0,,0,0,0,0,0,0,0,0,0,0,
I: What source code changes did you do in order to solve this task?,,,0,0,0,0,0,,0,,0,0,0,0,0,0,0,0,0,0,
What I ended up doing was I changed the method signature for various methods but it effectively ended up being the same.. it was similar to the previous task of I approached it slightly differently instead of copying - cutting it out putting it into another method deleting the old method and changing it what I did was I stayed in the existing method removed the method signature changed things up and then deleted the overridden method. The reason I did that was compared to the other task which was kind of an inversion thing because this had to do with overridden methods instead the names were the same to me it made more sense instead of actually lifting the code into somewhere else - the other way to do the previous would have been delete this one and rename the other one but because it had the same name I just decided it was simpler to keep everything here and delete the overridden one or the shorter argument - the same number of argument version.,,,0,0,0,0,0,,0,,0,0,0,0,0,0,0,0,0,0,
I: So you said you changed the parameters..,,,0,0,0,0,0,,0,,0,0,0,0,0,0,0,0,0,0,
I changed the parameters went to the logic and removed it also updated other methods that used the same thing checked the logic to make sure confirm that it was just a nothing was ever set specifically. And in the case that it was set specifically those were different methods and those were always set to false. And by doing that I knew that it wouldn't change because it was the same as calling it with the default so I made sure no behavior was changed major behavior was preserved. Then I updated the tests and I saw the tests and just relied on the compilation errors and I just removed them because they were not testing those cases any more.,,,0,0,0,0,0,,0,,0,0,0,0,0,0,0,0,0,0,
I: Do you know of any tools that could automate any of these changes?,,,0,0,0,0,0,,0,,0,0,0,0,0,0,0,0,0,0,
