01:00,,,Predictable (9),Effective (4),Satisfaction (7),Trust (6),Efficient (8),Vector: ,Invoke (3),Row Range, Predictable (6), Effective (3), Satisfaction (3), Trust (3), Efficient (3),Not Predictable (3),Not Effective (1),Not Satisfaction (4),Not Trust (3),Not Efficient (5),Refactorings
"tests have been written
 For the tasks I should assume that the unit tests are correct and if they're failing that means that they are failing because of the tests. 
 I: Yes this is like an existing project. Let's imagine that this is between releases.
 Ok so someone has already .. ok. 
 Ok, so start with a plan, change it at will.
 I: Yes, it's very free. I might stop you before you complete the task because I'm interested in how you 
 If you think, you'll probably finish this anyway. 
 I am ready to begin the first task.",,,0,0,0,0,0,,0,,0,0,0,0,0,0,0,0,0,0,
,,,0,0,0,0,0,,0,,0,0,0,0,0,0,0,0,0,0,
,,,0,0,0,0,0,,0,,0,0,0,0,0,0,0,0,0,0,
,,,0,0,0,0,0,,0,,0,0,0,0,0,0,0,0,0,0,
,,,0,0,0,0,0,,0,,0,0,0,0,0,0,0,0,0,0,
,,,0,0,0,0,0,,0,,0,0,0,0,0,0,0,0,0,0,
,,,0,0,0,0,0,,0,,0,0,0,0,0,0,0,0,0,0,
,,,0,0,0,0,0,,0,,0,0,0,0,0,0,0,0,0,0,
[03:50],,,0,0,0,0,0,,0,,0,0,0,0,0,0,0,0,0,0,
T1.,,,0,0,0,0,0,,0,,0,0,0,0,0,0,0,0,0,0,
Locate the relevant tests.,,,0,0,0,0,0,,0,,0,0,0,0,0,0,0,0,0,0,
I'll just search for the - I'll just find.. testIsAnyEmpty..,,,0,0,0,0,0,,0,,0,0,0,0,0,0,0,0,0,0,
I'm just going to assume that what you're giving me is correct that there's not some trick and that they all exist.,,,0,0,0,0,0,,0,,0,0,0,0,0,0,0,0,0,0,
Ok I see. There's two different test files and we wanna create a single test - we wanna extract these methods and put them into this test file.,,,0,0,0,0,0,,0,,0,0,0,0,0,0,0,0,0,0,
That sounds pretty straightforward. The simplest thing to do is just to hope that you can copy-paste them all from one place to another and see what breaks. There might be some declarations that aren't there. And there might be some kind of tester thing that is initialized. I assume StringUtils is just one - and StringUtilsTrimEmpty - I'm not sure why there's a separate class for this but there is. And yeah this sounds really straightforward. It sounds like it's just a copy-paste job. I think one of the harder parts - I think it's going to be easy to copy over and get that to work than it is to clean up the remaining stuff because there might be certain variables or such which are - I have to identify which ones are the ones only for the tests I extracted which I assume need to be removed because otherwise they're just redundant doing nothing but hopefully the IDE should catch that and say you're not using this any more. Ok I think that sounds good. How does this approach sound?,,,0,0,0,0,0,,0,,0,0,0,0,0,0,0,0,0,0,
I: Good.,,,0,0,0,0,0,,0,,0,0,0,0,0,0,0,0,0,0,
Ok last thing do I .. because there's annotations.. So if I just create the test file and import junit ..then all the imports should come as well.,,,0,0,0,0,0,,0,,0,0,0,0,0,0,0,0,0,0,
Ok so where should I put this? Is there a stub already or should I make it?,,,0,0,0,0,0,,0,,0,0,0,0,0,0,0,0,0,0,
I: there's no stub,,,0,0,0,0,0,,0,,0,0,0,0,0,0,0,0,0,0,
Interesting. The tests are all here but they decided to just leave them in different files. So I'll just follow convention instead of adding a different file. Because if they are expecting that then I'll do that. New file..,,,0,0,0,0,0,,0,,0,0,0,0,0,0,0,0,0,0,
Actually it may be easier.,,,0,0,0,0,0,,0,,0,0,0,0,0,0,0,0,0,0,
Especially if we're extracting StringUtilsTrimEmptyTest.. oh well.,,,0,0,0,0,0,,0,,0,0,0,0,0,0,0,0,0,0,
Something I would do is if the test is small enough is just to copy paste one and delete a bunch of it,,,0,0,0,0,0,,0,,0,0,0,0,0,0,0,0,0,0,
I: What do you mean by copy paste one?,,,0,0,0,0,0,,0,,0,0,0,0,0,0,0,0,0,0,
[07:39] I will start with one class one of the files as my reference. I'll make a clone of it remove - because there's four in here - remove all the other ones and I'll find the other ones and copy them in here. It might be easier for me to just use StringUtilsTest but I think there was a bunch of stuff in there that I .. I'll se which one to use. And I'm worrying I'm overthinking things but I'll just copy this one. StringUtilsTrimEmptyTest - ok we should come up with a name for this. For emptyAndBlankStrings. So how about I call it StringUtilsEmptyBlankTest - not the best name but we can change that later. it is important with names. Let's see StringUtilsTrimEmptyTest and StringUtilsEmptyBlankTest - let's not even get into that StringUtilsTest feels like it should encompass everything and I don't understand the actual reason why they have a StringUtilsTrimEmptyTest but I'm just going to call it StringUtilsEmptyBlankTest.,,,0,0,0,0,0,,0,,0,0,0,0,0,0,0,0,0,0,
I know that a lot of times people are hesitant to change stuff that already works because they don't want to break things.,,,0,0,0,0,0,,0,,0,0,0,0,0,0,0,0,0,0,
Ok we don't need all the stuff down here. Done. Goodbye.,,,0,0,0,0,0,,0,,0,0,0,0,0,0,0,0,0,0,
In the interest of time I'm not going to read this.,,,0,0,0,0,0,,0,,0,0,0,0,0,0,0,0,0,0,
Ok so my step 1 was combining step 2 was cleaning up and I forgot I have two different classes to combine from. So I'll just start copying as I got. TestIsEmpty - wait we have already done these. So I'll just remove them. Oh how convenient that this comment line is already here. It looks like the only thing that is - oh what's the IntelliJ hotkey for removing imports? I remember in Eclipse. It looks like the only thing I need to do here is to remove imports because it looks like the only thing defined across classes is foo. Might need to update the documentation.,,,0,0,0,0,0,,0,,0,0,0,0,0,0,0,0,0,0,
So that looks good right now. And then StringUtilsTest.,,,0,0,0,0,0,,0,,0,0,0,0,0,0,0,0,0,0,
Where are we now. testIsAnyEmpty. Oh here it is. I'm going to copy now - testIsAnyEmpty .... how convenient that they are in this block together.,,,0,0,0,0,0,,0,,0,0,0,0,0,0,0,0,0,0,
I: so now you just cut them out?,,,0,0,0,0,0,,0,,0,0,0,0,0,0,0,0,0,0,
Yeah. I'm going to just separate these. That way I can at least know that that was the division.,,,0,0,0,0,0,,0,,0,0,0,0,0,0,0,0,0,0,
I: Is that doing something you're doing because you want to keep it in the final class or to help you think.,,,0,0,0,0,0,,0,,0,0,0,0,0,0,0,0,0,0,
To help me think. Actually I'm not sure if I want to keep it in the final class or not but for now it's just to help me think. That's why I only partially completed it.,,,0,0,0,0,0,,0,,0,0,0,0,0,0,0,0,0,0,
"Back to here. I have removed it. No wait that is the wrong one that's already saved. Save let's see. Is there any, looks like all the imports are still the same looks like the variables are still the same the green lines are more about typos. Looks like there are some static pre-initialized things that will come up later well we'll see if I need them later. I just realized something I could have done in hindsight which is to - no wait I assume the tests were passing anyway.",,,0,0,0,0,0,,0,,0,0,0,0,0,0,0,0,0,0,
I: what was that?,,,0,0,0,0,0,,0,,0,0,0,0,0,0,0,0,0,0,
"In hindsight I should have ran the tests on both of them first to validate what the functionality was, but - because now I'm not seeing any errors, not any compilation errors, expected values. I'm just going to run this and see if it works. I assume the red is git [14:07] 
 Well this is Java and it should have compiled and it should have complained if there was something.",,,0,0,0,0,0,,0,,0,0,0,0,0,0,0,0,0,0,
,,,0,0,0,0,0,,0,,0,0,0,0,0,0,0,0,0,0,
I: you mention that you're not a power user of IntelliJ what do you usually work with?,,,0,0,0,0,0,,0,,0,0,0,0,0,0,0,0,0,0,
It depends usually Eclipse. *lists keycombinations for Eclipse*,,,0,0,0,0,0,,0,,0,0,0,0,0,0,0,0,0,0,
"Oh it's fast, hey I think that's good.",,,0,0,0,0,0,,0,,0,0,0,0,0,0,0,0,0,0,
"I think this works. I can't think of anything I've missed, this looks like a fairly straightforward approach.",,,0,0,0,0,0,,0,,0,0,0,0,0,0,0,0,0,0,
I: Ok. Please tell me in your own words what kind of source code changes you did in order to solve the task?,,,0,0,0,0,0,,0,,0,0,0,0,0,0,0,0,0,0,
"What kind of source code changes? Method extraction, it's just simply moving methods from one place to another and cleaning up the previous classes to make sure that you're not leaving anything redundant behind. I guess technically I should run the other tests to make sure that they still run, but considering they are unit tests, each of them should be self contained. So code changes, literally just moving them around. No code changes, just copy-and-paste moving. And potentially looking for - like seeing if I missed anything but there weren't any.",,,0,0,0,0,0,,0,,0,0,0,0,0,0,0,0,0,0,
I: Are there any changes you are unsure if you got right?,,,0,0,0,0,0,,0,,0,0,0,0,0,0,0,0,0,0,
In general because I don't understand this fully I'm a little hesitant but considering all the tests are passing right now and I have a decent degree of confidence that it is working?,,,0,0,0,0,0,,0,,0,0,0,0,0,0,0,0,0,0,
I: What do you mean by not understanding it fully?,,,0,0,0,0,0,,0,,0,0,0,0,0,0,0,0,0,0,
I mean I haven't read everything. They are pretty simple tests I guess. It seems to simple.,,,0,0,0,0,0,,0,,0,0,0,0,0,0,0,0,0,0,
I: Let's move on.,,,0,0,0,0,0,,0,,0,0,0,0,0,0,0,0,0,0,
T2: [17:15],,,0,0,0,0,0,,0,,0,0,0,0,0,0,0,0,0,0,
Locate the methods in StringUtils.java. Just checking if these are any of the ones we moved? This is weird I'm searching and it's not here.. Oh right! I'm looking in the StringUtilsTests and this is in the ..,,,0,0,0,0,0,,0,,0,0,0,0,0,0,0,0,0,0,
"There is a command in IntelliJ to look for - ah that's it. [18:34] StringUtils that's the one then - what window am I in, this is just the tests. Here is StringUtils isAllEmpty here it is. Return negation of IsAnyNotEmpty - seems simple enough - and isAllBlank. There we go. So these methods that call other methods. And we ...remove methods isAnyNotBlank and isAnyNotEmpty - I'm just curious is there a reason why they didn't ask me to locate those methods first. It's been communicated to me that these methods are no longer necessary. Based on what I'm reading it's not like - this is what I am considering - if we remove these methods are we removing anything unintentionally like maybe something was - some methods call other methods so making sure nothing else was removed. I'm thinking right now, based on this, if I remove isAnyNotBlank and isAnyNotEmpty the biggest thing I need to worry about is if they are called in the tests but I have a feeling that is - oh wait what am I thinking - isAllBlank calls the negation of isAnyNotBlank - I see.",,,0,0,0,0,0,,0,,0,0,0,0,0,0,0,0,0,0,
"They want to remove it and put all in here. The easiest thing I can think of doing is, if we want to just remove this from the API, we can just make them private methods, and that way we know that no one external calls them. That way because the emphasis is that it's confusing to use double negation maybe we do want to extract them to here but literally if I was asked for the simplest way to do this I was make them private and be done with it. But I'm not sure that goes against the spirit of this. I would ask for more clarification.",,,0,0,0,0,0,,0,,0,0,0,0,0,0,0,0,0,0,
I: In this case you should remove the method declarations.,,,0,0,0,0,0,,0,,0,0,0,0,0,0,0,0,0,0,
What I'm going to do since we have tests for this I'll look at the stringUtilsTest and look at isAllBlank.,,,0,0,0,0,0,,0,,0,0,0,0,0,0,0,0,0,0,
I: I'll remind you that you moved some tests so they might be in the other class.,,,0,0,0,0,0,,0,,0,0,0,0,0,0,0,0,0,0,
Ok so this is going to be in my new StringUtilsEmptyBlankTest.,,,0,0,0,0,0,,0,,0,0,0,0,0,0,0,0,0,0,
"[22:13] The good news is if I remove this method, if anything goes wrong, it should break a lot of stuff in here, and that will be a good way to know. So what I'll do is, I'll run the tests, make sure it's passing, then the thing I'll do is remove it, and it'll break - we know it'll break -- then I'll fix it. Functionality should be preserved.",,,0,0,0,0,0,,0,,0,0,0,0,0,0,0,0,0,0,
Consider they're just wrappers - the first thing I'll do is I'll copy. This is isAnyNotBlank and this is - wrong - isAnyNotBlank. Where did that method go..,,,0,0,0,0,0,,0,,0,0,0,0,0,0,0,0,0,0,
I noticed I'm using find a lot because it's common across IDEs. What I normally do is I comment things out and leave them there until I have to remove them so I have a frame of reference.,,,0,0,0,0,0,,0,,0,0,0,0,0,0,0,0,0,0,
I: Why is that?,,,0,0,0,0,0,,0,,0,0,0,0,0,0,0,0,0,0,
"In case I ever need to refer to them after deleting them I don't want to undo it, if I need a reference point for something I got rid of.",,,0,0,0,0,0,,0,,0,0,0,0,0,0,0,0,0,0,
I: By reference point do you mean just for yourself?,,,0,0,0,0,0,,0,,0,0,0,0,0,0,0,0,0,0,
Yeah. It also makes it easier if I need to preserve something I don't want to delete it straight away. It's a bit of a hoarder mentality; I'll delete it later but I'll keep it around until I need to.,,,0,0,0,0,0,,0,,0,0,0,0,0,0,0,0,0,0,
ArrayUtils.isEmpty css return false,,,0,0,0,0,0,,0,,0,0,0,0,0,0,0,0,0,0,
Firstly I know that this is the negation of isAnyNotBlank,,,0,0,0,0,0,,0,,0,0,0,0,0,0,0,0,0,0,
"by the way, I want to check, is anyNotBlank used elsewhere? No, thank god.",,,0,0,0,0,0,,0,,0,0,0,0,0,0,0,0,0,0,
I: So you're checking if it's used elsewhere by searcing textually in this class?,,,0,0,0,0,0,,0,,0,0,0,0,0,0,0,0,0,0,
Yes I know that there are certain things that could look for it but I guess I'm not as familiar as I thought. Analyze dependencies?,,,0,0,0,0,0,,0,,0,0,0,0,0,0,0,0,0,0,
I: Here it's find usages.,,,0,0,0,0,0,,0,,0,0,0,0,0,0,0,0,0,0,
Ok! Looks like it's going to break a lot of stuff in testAnyNotBlank. Good to know. Well since we remove this we know it'll mess up. But that's what the tests are for. We'll fix and correct it. And I can read those tests while transition anyway.,,,0,0,0,0,0,,0,,0,0,0,0,0,0,0,0,0,0,
isAllBlank isAllEmpty,,,0,0,0,0,0,,0,,0,0,0,0,0,0,0,0,0,0,
how is this used actually?,,,0,0,0,0,0,,0,,0,0,0,0,0,0,0,0,0,0,
So we test isAllBlank and we test isAnyBlank. I guess if we remove it we don't really need those tests because that other methods is tested and everything should pass here so that's good to know.,,,0,0,0,0,0,,0,,0,0,0,0,0,0,0,0,0,0,
I know that everything here is a negation of something else so what I can really do is just switch from return true to return false and return false to return true. Something that makes me wonder is that my math wasn't very good so I'm wondering if there's anything I'm forgetting so I know that just reverting things isn't necessarily the case let's see if ArrayUtils is empty return true - that seemes straightforward. And for each one run isNotBlank if it is not blank return false. Yeah that makes sense actually as soon as you find one return true so that means that you have to go through the entire thing to return false. Oh wait yeah because sorry it's a similar thing because as soon as you find one that is blank you know it is going to be false. it no longer fills your case. Similarly other way around. This isn't that complicated. And the last one is return true because it passes everything.,,,0,0,0,0,0,,0,,0,0,0,0,0,0,0,0,0,0,
"Did I revert this one yet? What I'm doing is I'm looking more into the code. I'm relying a lot on shortcuts I'm just going to look at the code and assume it's gospel as opposed to sitting back and writing the methods from scratch. That's probably more useful to understand the spirit behind it. At this point I just realised, I'm not understanding, I’m just flipping switches. Yes return false return true. Ok there's that.",,,0,0,0,0,0,,0,,0,0,0,0,0,0,0,0,0,0,
I'm going to go back to here. They said that there was the class - is anyNotBlank we already know where this is used findUsages we know it's used here. I believe that because we are deleting this we should be able to just delete that test and the other tests should just pass. Teachnically I could just - I could just keep this and not remove that test yet. Where was it testIsAnyNotBlank. Ok. I'm just going to run it and see if this works. The other reasons I'm doing this is that if I notice there's something horribly wrong with my approach I'd rather know now rather than later.,,,0,0,0,0,0,,0,,0,0,0,0,0,0,0,0,0,0,
I: By 'doing this' do you mean running the tests?,,,0,0,0,0,0,,0,,0,0,0,0,0,0,0,0,0,0,
Yes because I realise I only half completed the task but since I'm approaching them in the same way I'm running it halfway through because I don't want to finish the task and find out that they don't work and then have wasted a lot of time.,,,0,0,0,0,0,,0,,0,0,0,0,0,0,0,0,0,0,
Everything passed.,,,0,0,0,0,0,,0,,0,0,0,0,0,0,0,0,0,0,
Let's get back to the other one then. So that was blank and this is empty. Did I have another window open for the structure. IsBlank isAnyNotEmpty is the one i looked at earlier. By the way it is kind of confusing is-any-not-empty Honestly yeah why do people use it if you wanna use this why don't you just run the negation of that why have a separate method for it? I guess you're wrapping it anyway so it doesn't really matter. So I've decided to abandon my hoarding ways and just delete ahead of time.,,,0,0,0,0,0,,0,,0,0,0,0,0,0,0,0,0,0,
I: How come?,,,0,0,0,0,0,,0,,0,0,0,0,0,0,0,0,0,0,
I'm not sure honestly I kind of did that instinctually. In hindsight it's probably because my first approach worked well and I feel comfortable doing that now. But this is given in hindsight so I know it's not reliable. isAll - is it isAllEmpty? Yes.,,,0,0,0,0,0,,0,,0,0,0,0,0,0,0,0,0,0,
I also just realised I [comment] this one. Looks like my approach was pretty straightforward just revert everything. And we go here and because the approach worked so well here - and this is actually very easy now because my handy code editor started vomiting,,,0,0,0,0,0,,0,,0,0,0,0,0,0,0,0,0,0,
I: What do you mean by vomiting?,,,0,0,0,0,0,,0,,0,0,0,0,0,0,0,0,0,0,
All the error messages,,,0,0,0,0,0,,0,,0,0,0,0,0,0,0,0,0,0,
I: So what did that tell you?,,,0,0,0,0,0,,0,,0,0,0,0,0,0,0,0,0,0,
That something went wrong. One second why is StringUtils .. oh it hadn't updated. So I've been working a long time in non-compiled languages so the fact that I removed this it mean it updated pretty quickly to be like I cannot find the reference to this because it's a compiled language I can rely on the compiler as a nice I guess safety vaulve. I had already searched I knew it was used by only one other that's why I didn't keep it around.,,,0,0,0,0,0,,0,,0,0,0,0,0,0,0,0,0,0,
I had kind of presearched so I knew it was only used by one thing that's why I didn't keep it around.,,,0,0,0,0,0,,0,,0,0,0,0,0,0,0,0,0,0,
I: So the error messages are like ..,,,0,0,0,0,0,,0,,0,0,0,0,0,0,0,0,0,0,
The compiler complaining I'm using that as a visual bag. Since I know it is about method removal the compiler will complain when the method is not being used so I can just go there when the method has been removed. I'm going to run the tests again just in case.,,,0,0,0,0,0,,0,,0,0,0,0,0,0,0,0,0,0,
I: So when the compiler gives you the errors it sounds like that also helps you think rather than that being the final result so to speak.,,,0,0,0,0,0,,0,,0,0,0,0,0,0,0,0,0,0,
I use a lot of different data points. But yes having the compiler complain is nice to me. Well I don't like having it complain but it's useful feedback.,,,0,0,0,0,0,,0,,0,0,0,0,0,0,0,0,0,0,
Looks like it worked. I feel like I'm done: I removed it from the API so we don't need to test it any more I'm not using anything in the tests. And the tests have been updated. I guess technically what I should have done is look in StringUtils - I should have looked ahead of time - that by removing that method is there any imports or global variable declarations that are no longer used. And it looks like - no that's a static method so it could be used elswhere - and no - the methods are still there I literally just copy-pasted them over; I'm overthinking. Yeah I think it's done.,,,0,0,0,0,0,,0,,0,0,0,0,0,0,0,0,0,0,
I: Can you explain in your own words the source code changes you did in order to solve this task?,,,0,0,0,0,0,,0,,0,0,0,0,0,0,0,0,0,0,
Let's see. I removed - moved functionality from one method to another and I slightly modified it to fit the new parameters and I removed the old method and any usages. And I ran the tests to ensure that the functionality was preserved. And I was fairly confident about this despite on record talking about the unconfidence because the tests are passing. And because the code itself looks very simple. It's literally just a negation of a wrapped function and now we unwrapped a function. So I guess another way to put it is I'm unwrapping a function moving it somewhere else and negating it; I'm just inverting a wrapped function.,,,0,0,0,0,0,,0,,0,0,0,0,0,0,0,0,0,0,
I: You were reading it as well..,,,0,0,0,0,0,,0,,0,0,0,0,0,0,0,0,0,0,
Yes I had to make sure that it was just a simple case of inverting the signs inside the code 'cause I know ahead of time you can do it with the final result but within - I guess I'm contradicting myself because you should just be able to invert them ..,,,0,0,0,0,0,,0,,0,0,0,0,0,0,0,0,0,0,
I: Do you know of any tools that could have automated the changes you did?,,,0,0,0,0,0,,0,,0,0,0,0,0,0,0,0,0,0,
No but I'm also not a power user?,,,0,0,0,0,0,,0,,0,0,0,0,0,0,0,0,0,0,
I: Did you do any repetitive code changes during the task?,,,0,0,0,0,0,,0,,0,0,0,0,0,0,0,0,0,0,
Yeah it was pratically the same: copy-pasting deleting and flipping the return values.,,,0,0,0,0,0,,0,,0,0,0,0,0,0,0,0,0,0,
I: If you had a tool that could automate that would you trust it?,,,0,0,0,0,0,,0,,0,0,0,0,0,0,0,0,0,0,
I'm a self-admitted ludite someone who fears technology - ok that's a bit of an exhaggeration but for me it's like if I knew this tool existed and I'd used it enough.. I wouldn't trust the tool to work just because I was given a tool I'd have to see it work enough times before I trust it. But I always verify because I know that tools can be faul.,"Reflection
Trust",,0,0,0,1,0,"<0,0,0,1,0>",0,106-106,0,0,0,1,0,0,0,0,0,0,
I: So you'd just need to use it so you'd trust it in order to use it?,,,0,0,0,0,0,,0,,0,0,0,0,0,0,0,0,0,0,
If someone told me to use it I'd try it and the first few times I'd be slow and check the output each time but given enough time I'd start trusting it.,,,0,0,0,0,0,,0,,0,0,0,0,0,0,0,0,0,0,
I: Is there any parts of the code changes you're unsure if you got right?,,,0,0,0,0,0,,0,,0,0,0,0,0,0,0,0,0,0,
Just the signs because I'm worried I missed something. The return values I'm worried I left one by mistake but I'm pretty confident about them. That's the part I was most paranoid about making sure that the logic was still the same.,,,0,0,0,0,0,,0,,0,0,0,0,0,0,0,0,0,0,
I: So you were reading the names of the other functions to make sure,,,0,0,0,0,0,,0,,0,0,0,0,0,0,0,0,0,0,
yeah just making sure it was doing what I thought it was doing.,,,0,0,0,0,0,,0,,0,0,0,0,0,0,0,0,0,0,
T3[38:50],,,0,0,0,0,0,,0,,0,0,0,0,0,0,0,0,0,0,
I'm trying to make sure I understand this correctly: There's an API for reading and editing fields and there's an argument that is called forceAccess and you check if forceAccess is true do some logic else do other logic. But right now we're like forceAccess should always be false. Again the lazy way - or the hacky way - the first thing you do as soon as you enter the argument you set it to false. But I guess the problem with that is that people will see the API and say why is this not working. I would like to read the methods first.,,,0,0,0,0,0,,0,,0,0,0,0,0,0,0,0,0,0,
This is a new class FieldUtils. Let's open the tests that's probably somewhere. reading: Locate the code and test - oh so this is the entire file! Ok let's see. forceAccess is a parameter under getField let's see where else. Wait how many methods are in here. ForceAccess is a boolean. Looking to see what else would use it. I'm assuming anything with a boolean in here is using forceaccess. Let's look at the tests real quick. So this probably seems like the most complicated of them all. There is testgetfield. Fieldutilstestgetfield. Which methods had the forceaccess? There's no default parameter right? It's not like if you don't fill it in.. no this is java you have to fill it in. If you want to set default parameter the last time I worked with java if you want to set a default parameter you just write a wrapperfunction called getfield and like prepopulate the default function. Like this one. Looks like there's already some default stuff. Yeah sorry a lazy approach is just to make the other one private so you can only use this one but I assume we don't want to do it that way.,,,0,0,0,0,0,,0,,0,0,0,0,0,0,0,0,0,0,
I: You don't want to keep that kind of code quality.,,,0,0,0,0,0,,0,,0,0,0,0,0,0,0,0,0,0,
That's the lazy way. Now what we could do then.. So what's happening is that it's kind of similar to the last task in that that we're moving this in here and then removing all references to the forceaccess parameter being used. The way I think about approaching this now - by the way the previous task has kind of primed me for this - is that I would look for how getfield is being used - this particular getfield with this particular signature with the forceaccess because I already know there are usages of the default one - and I'll probably remove any usages where you set this to true because it looks like the default one is being used in the tests and I'm just going to validate that now. One usage.. line 59.. it's also used in readField .. this has gotten slightly more complicated.,,,0,0,0,0,0,,0,,0,0,0,0,0,0,0,0,0,0,
